id,title,body,parent_id,np,user_id,facilitation,invisible,top_fix,created_at,updated_at,theme_id,image,has_point,has_reply,agreement,claster,stamp
27,企業戦略の賜物,"スマートフォンが流行った，というより企業戦略によって流行らせたものだと思う
スマートフォン向けのアプリとかサービス多いし
提供サービスが増えるから使用者も増えるし，使用者が増えるから提供サービスも増えるような好循環になってる
逆にガラケーなんかはその逆の悪循環に陥っている",,0,4,false,false,false,2015-06-15 11:26:52,2015-11-25 18:49:17,3,,,,false,1,
32,,"アプリ開発の好循環は確かに素晴らしい。
開発で稼げるというのは、ガラケー時代を思えば画期的。
使用者が同時に開発者にもなれる時代が来るとは思ってもいませんでした。",27,60,1,false,false,false,2015-06-15 11:35:56,2015-11-18 14:28:48,3,,,,false,,
35,,"たしかにガラケーは楽しめるアプリのようなものが少ないイメージがあります。
ガラケーの使用者が減っていくのも無理はないですね。",27,58,6,false,false,false,2015-06-15 11:38:43,2015-11-18 14:28:48,3,,,,false,,
150,,"スマホの流行り方は，youtubeやニコニコのような動画サイト，初音ミクのようなボカロなどのように，誰でもアプリの製作者になり，誰でもアプリを利用できるという魅力によるものとも考えられます
「誰でも」という部分による好循環を見出した企業戦略はすごいと思います",27,67,8,false,false,false,2015-06-16 13:02:59,2015-11-18 14:28:47,3,,,,false,,
151,,"アプリ開発などいろいろな方面から企業がバックアップをしているお陰でいい方面へ向かっているというのを自分も感じます
全体的にスマホの誕生にどの企業も乗っかりたいんでしょうねw",27,59,11,false,false,false,2015-06-16 13:19:45,2015-11-18 14:28:47,3,,,,false,,
49,,"その昔、GR○Eという会社があってですね。
任○堂を越えるとか何とか言ってました・・・",35,43,1,false,false,false,2015-06-15 12:07:28,2015-11-18 14:28:45,3,,,,false,,
221,,OKOK!!,49,50,2,false,false,false,2015-11-18 13:18:36,2015-11-18 14:28:45,3,,,,false,,
