id,title,body,parent_id,np,user_id,facilitation,invisible,top_fix,created_at,updated_at,theme_id,image,has_point,has_reply,agreement,claster,stamp
6,スマホの便利なところ,"現代社会において、スマホはもはや必需品と言っても過言ではないほど普及しています。
スマホがここまで普及したのは、やはり「スマホが便利だから」という理由が大きいと思います。
あなたは、どんなところでスマホが便利だと感じますか？",,0,1,false,false,false,2015-06-11 11:09:10,2015-11-19 10:05:00,1,,,,false,1,
7,,"スマホの便利なところといえば、やはりPCとの親和性だと思います。
特にiPhoneとMacなら、同じApple製品ですし、相性は抜群。
連絡先やメモ帳の同期はもちろん、パスワード管理まで共有してくれるなんて、とても便利だと思いませんか？",6,62,39,false,false,false,2015-06-11 11:12:57,2015-11-18 14:28:49,1,,,,false,,
