id,title,body,parent_id,np,user_id,facilitation,invisible,top_fix,created_at,updated_at,theme_id,image,has_point,has_reply,agreement,claster,stamp
116,小学生以下にスマホを持たせるのは賛成か反対か,"今や小学生ですら、スマホを所持している事が多い世の中。
本当に、彼らには必要なのか？？
改めて、スマホ人口が増えた今こそ、発育途上である子供達にスマホは必要なのかどうかを考えたい。

私は、子供達はスマホを持つべきではないと思う。
スマホを持っているのが至極当たり前かのような風潮に我々現代人は麻痺しているのかもしれない。
スマホによるいじめや、傷害事件まで発展したトラブルの各種を見ると、どうもら中身が子供では扱えきれるツールではないと考える。",,0,41,false,false,false,2015-06-15 21:21:52,2015-12-01 11:06:26,5,,,,false,1,
122,,"この議題、個人的にはかなり難しい問題だと思ってます。
未だに自分の中でも明瞭な答えがありません。
ただ思うのは、スマホやガラケーの無かった時代の枠組みで、一方的に「子供にケータイ・スマホはいけない」と決め付けるのはどうかなぁと思います。
(Wadyさんの発言がどうというワケではなく^^;)
ガラケーやスマホの普及に合わせて、世の中や子供たちの周りの環境も常に変化しているわけですしね。
スマホの良い面、悪い面を照らして、総合的に判断すべきとは思いますが・・・やっぱり難しい問題だと思います。。",116,52,35,false,false,false,2015-06-15 21:57:07,2015-11-18 14:28:47,5,,,,false,,
134,,バイトで塾講師をやっていますが、生徒さんからは、今や小中学生にとってスマホは持ってて当たり前な物だという話をよく聞きます。,116,58,1,false,false,false,2015-06-15 22:39:56,2015-11-18 14:28:47,5,,,,false,,
148,,"賛否両論でしょうけど僕は小学生以下のスマホ所持は賛成ですね。
最も大きな理由は若い人の可能性を奪いたくないからです。
良いことも悪いことも若いうちに経験して欲しいと思ってます。",116,100,28,false,false,false,2015-06-16 12:27:11,2015-11-18 14:28:46,5,,,,false,,
166,,"時代の流れ的に持たせないと言うことは出来ないと思います。
しかし、最初の頃は機能を大きく制限する必要があると思います。
成長に合わせて段階的に、機能を開放して行くべきではないでしょうか？",148,55,34,false,false,false,2015-06-16 19:51:23,2015-11-18 14:28:46,5,,,,false,,
171,,"逆に、スマホを持たせられる時期っていつ頃からなんでしょうね？？
年齢もそうですが、精神的、思考力的にどんな風に・どれだけ成熟すれば安全に使いこなせるのか…",116,47,35,false,false,false,2015-06-16 22:32:32,2015-11-18 14:28:46,5,,,,false,,
